{
  "$schema": "./_schemas/_index_schema.json",
  "version": 2,
  "generated_at": "2026-05-02",
  "description": "IPS 全局文档索引 — Agent 入口地图。所有路径相对于 docs/ 目录。",
  "tables": {
    "{数据模块A}": "02_backend/data-model/tables/{数据模块A}.json",
    "{数据模块B}": "02_backend/data-model/tables/{数据模块B}.json",
    "{数据模块C}": "02_backend/data-model/tables/{数据模块C}.json",
    "{数据模块D}": "02_backend/data-model/tables/{数据模块D}.json",
    "{数据模块E}": "02_backend/data-model/tables/{数据模块E}.json",
    "{数据模块F}": "02_backend/data-model/tables/{数据模块F}.json",
    "{数据模块G}": "02_backend/data-model/tables/{数据模块G}.json",
    "{数据模块H}": "02_backend/data-model/tables/{数据模块H}.json",
    "{数据模块I}": "02_backend/data-model/tables/{数据模块I}.json",
    "{数据模块J}": "02_backend/data-model/tables/{数据模块J}.json",
    "{数据模块K}": "02_backend/data-model/tables/{数据模块K}.json",
    "{数据模块L}": "02_backend/data-model/tables/{数据模块L}.json",
    "{数据模块M}": "02_backend/data-model/tables/{数据模块M}.json",
    "{模块A}": "02_backend/data-model/tables/{模块A}.json",
    "{模块B}": "02_backend/data-model/tables/{模块B}.json",
    "{模块C}": "02_backend/data-model/tables/{模块C}.json",
    "{模块D}": "02_backend/data-model/tables/{模块D}.json",
    "{模块E}": "02_backend/data-model/tables/{模块E}.json",
    "{模块F}": "02_backend/data-model/tables/{模块F}.json",
    "{模块G}": "02_backend/data-model/tables/{模块G}.json",
    "{模块H}": "02_backend/data-model/tables/{模块H}.json",
    "{集成模块A}": "02_backend/data-model/tables/{集成模块A}.json",
    "{集成模块B}": "02_backend/data-model/tables/{集成模块B}.json",
    "{集成模块C}": "02_backend/data-model/tables/{集成模块C}.json",
    "{集成模块D}": "02_backend/data-model/tables/{集成模块D}.json",
    "{营销模块A}": "02_backend/data-model/tables/{营销模块A}.json",
    "{交易模块A}": "02_backend/data-model/tables/{交易模块A}.json",
    "{交易模块B}": "02_backend/data-model/tables/{交易模块B}.json",
    "{业务模块A}": "02_backend/data-model/tables/{业务模块A}.json",
    "{业务模块B}": "02_backend/data-model/tables/{业务模块B}.json",
    "{财务模块B}": "02_backend/data-model/tables/{财务模块B}.json",
    "{财务模块A}": "02_backend/data-model/tables/{财务模块A}.json",
    "{运营模块A}": "02_backend/data-model/tables/{运营模块A}.json",
    "{采购模块A}": "02_backend/data-model/tables/{采购模块A}.json"
  },
  "enums": {
    "Global_Common": "02_backend/data-model/enums/Global_Common.json",
    "{数据模块A}": "02_backend/data-model/enums/{数据模块A}.json",
    "{数据模块B}": "02_backend/data-model/enums/{数据模块B}.json",
    "{数据模块C}": "02_backend/data-model/enums/{数据模块C}.json",
    "{数据模块D}": "02_backend/data-model/enums/{数据模块D}.json",
    "{数据模块E}": "02_backend/data-model/enums/{数据模块E}.json",
    "{数据模块F}": "02_backend/data-model/enums/{数据模块F}.json",
    "{数据模块G}": "02_backend/data-model/enums/{数据模块G}.json",
    "{数据模块H}": "02_backend/data-model/enums/{数据模块H}.json",
    "{数据模块I}": "02_backend/data-model/enums/{数据模块I}.json",
    "{数据模块J}": "02_backend/data-model/enums/{数据模块J}.json",
    "{数据模块K}": "02_backend/data-model/enums/{数据模块K}.json",
    "{数据模块L}": "02_backend/data-model/enums/{数据模块L}.json",
    "{模块A}": "02_backend/data-model/enums/{模块A}.json",
    "{模块B}": "02_backend/data-model/enums/{模块B}.json",
    "{模块C}": "02_backend/data-model/enums/{模块C}.json",
    "{模块D}": "02_backend/data-model/enums/{模块D}.json",
    "{模块E}": "02_backend/data-model/enums/{模块E}.json",
    "{模块F}": "02_backend/data-model/enums/{模块F}.json",
    "{模块G}": "02_backend/data-model/enums/{模块G}.json",
    "{模块H}": "02_backend/data-model/enums/{模块H}.json",
    "{集成模块A}": "02_backend/data-model/enums/{集成模块A}.json",
    "{集成模块B}": "02_backend/data-model/enums/{集成模块B}.json",
    "{集成模块C}": "02_backend/data-model/enums/{集成模块C}.json",
    "{集成模块D}": "02_backend/data-model/enums/{集成模块D}.json",
    "{营销模块A}": "02_backend/data-model/enums/{营销模块A}.json",
    "{交易模块A}": "02_backend/data-model/enums/{交易模块A}.json",
    "{交易模块B}": "02_backend/data-model/enums/{交易模块B}.json",
    "{业务模块A}": "02_backend/data-model/enums/{业务模块A}.json",
    "{业务模块B}": "02_backend/data-model/enums/{业务模块B}.json",
    "{财务模块B}": "02_backend/data-model/enums/{财务模块B}.json",
    "{财务模块A}": "02_backend/data-model/enums/{财务模块A}.json",
    "{运营模块A}": "02_backend/data-model/enums/{运营模块A}.json",
    "{采购模块A}": "02_backend/data-model/enums/{采购模块A}.json"
  },
  "api": {
    "{数据模块A}": "03_api/contracts/{数据模块A}.json",
    "{数据模块B}": "03_api/contracts/{数据模块B}.json",
    "{数据模块C}": "03_api/contracts/{数据模块C}.json",
    "{数据模块D}": "03_api/contracts/{数据模块D}.json",
    "{数据模块E}": "03_api/contracts/{数据模块E}.json",
    "{数据模块F}": "03_api/contracts/{数据模块F}.json",
    "{数据模块G}": "03_api/contracts/{数据模块G}.json",
    "{数据模块H}": "03_api/contracts/{数据模块H}.json",
    "{数据模块I}": "03_api/contracts/{数据模块I}.json",
    "{模块A}": "03_api/contracts/{模块A}.json",
    "{模块B}": "03_api/contracts/{模块B}.json",
    "{模块C}": "03_api/contracts/{模块C}.json",
    "{模块D}": "03_api/contracts/{模块D}.json",
    "{模块E}": "03_api/contracts/{模块E}.json",
    "{模块F}": "03_api/contracts/{模块F}.json",
    "{模块G}": "03_api/contracts/{模块G}.json",
    "{模块H}": "03_api/contracts/{模块H}.json",
    "{集成模块A}": "03_api/contracts/{集成模块A}.json",
    "{集成模块B}": "03_api/contracts/{集成模块B}.json",
    "{集成模块C}": "03_api/contracts/{集成模块C}.json",
    "{集成模块D}": "03_api/contracts/{集成模块D}.json",
    "{营销模块A}": "03_api/contracts/{营销模块A}.json",
    "{交易模块A}": "03_api/contracts/{交易模块A}.json",
    "{交易模块B}": "03_api/contracts/{交易模块B}.json",
    "{业务模块A}": "03_api/contracts/{业务模块A}.json",
    "{业务模块B}": "03_api/contracts/{业务模块B}.json",
    "{财务模块B}": "03_api/contracts/{财务模块B}.json",
    "{财务模块A}": "03_api/contracts/{财务模块A}.json",
    "{运营模块A}": "03_api/contracts/{运营模块A}.json",
    "{采购模块A}": "03_api/contracts/{采购模块A}.json"
  },
  "api_globals": {
    "error_codes": "03_api/error-codes.json",
    "idempotency_spec": "03_api/idempotency-spec.md",
    "frontend_routes": "03_api/frontend-routes.md",
    "permission_registry": "03_api/permission-registry.json"
  },
  "state-machines": {
    "{数据模块A}": "02_backend/data-model/state-machines/{数据模块A}_fsm.json",
    "{数据模块B}": "02_backend/data-model/state-machines/{数据模块B}_fsm.json",
    "{数据模块C}": "02_backend/data-model/state-machines/{数据模块C}_fsm.json",
    "{数据模块D}": "02_backend/data-model/state-machines/{数据模块D}_fsm.json",
    "{数据模块E}": "02_backend/data-model/state-machines/{数据模块E}_fsm.json",
    "{数据模块F}": "02_backend/data-model/state-machines/{数据模块F}_fsm.json",
    "{数据模块G}": "02_backend/data-model/state-machines/{数据模块G}_fsm.json",
    "{数据模块H}": "02_backend/data-model/state-machines/{数据模块H}_fsm.json",
    "{数据模块I}": "02_backend/data-model/state-machines/{数据模块I}_fsm.json",
    "{数据模块J}": "02_backend/data-model/state-machines/{数据模块J}_fsm.json",
    "{数据模块K}": "02_backend/data-model/state-machines/{数据模块K}_fsm.json",
    "{数据模块L}": "02_backend/data-model/state-machines/{数据模块L}_fsm.json",
    "{模块A}": "02_backend/data-model/state-machines/{模块A}_fsm.json",
    "{模块B}": "02_backend/data-model/state-machines/{模块B}_fsm.json",
    "{模块C}": "02_backend/data-model/state-machines/{模块C}_fsm.json",
    "{模块D}": "02_backend/data-model/state-machines/{模块D}_fsm.json",
    "{模块E}": "02_backend/data-model/state-machines/{模块E}_fsm.json",
    "{模块F}": "02_backend/data-model/state-machines/{模块F}_fsm.json",
    "{模块G}": "02_backend/data-model/state-machines/{模块G}_fsm.json",
    "{模块H}": "02_backend/data-model/state-machines/{模块H}_fsm.json",
    "{集成模块A}": "02_backend/data-model/state-machines/{集成模块A}_fsm.json",
    "{集成模块B}": "02_backend/data-model/state-machines/{集成模块B}_fsm.json",
    "{集成模块C}": "02_backend/data-model/state-machines/{集成模块C}_fsm.json",
    "{集成模块D}": "02_backend/data-model/state-machines/{集成模块D}_fsm.json",
    "{营销模块A}": "02_backend/data-model/state-machines/{营销模块A}_fsm.json",
    "{交易模块A}": "02_backend/data-model/state-machines/{交易模块A}_fsm.json",
    "{交易模块B}": "02_backend/data-model/state-machines/{交易模块B}_fsm.json",
    "{业务模块A}": "02_backend/data-model/state-machines/{业务模块A}_fsm.json",
    "{业务模块B}": "02_backend/data-model/state-machines/{业务模块B}_fsm.json",
    "{财务模块B}": "02_backend/data-model/state-machines/{财务模块B}_fsm.json",
    "{财务模块A}": "02_backend/data-model/state-machines/{财务模块A}_fsm.json",
    "{运营模块A}": "02_backend/data-model/state-machines/{运营模块A}_fsm.json",
    "{采购模块A}": "02_backend/data-model/state-machines/{采购模块A}_fsm.json"
  },
  "registries": {
    "permission": "03_api/permission-registry.json",
    "nfr": "02_backend/specs/NFR_REGISTRY.md",
    "security_baseline": "02_backend/specs/SECURITY_BASELINE.md",
    "event": "02_backend/specs/EVENT_REGISTRY.md",
    "glossary": "00_meta/glossary.md"
  },
  "architecture": {
    "overview": "02_backend/architecture/overview.md",
    "codebase": "02_backend/architecture/codebase-architecture.md",
    "platform": {
      "_index": "02_backend/architecture/paas/_index.md",
      "_cross_cutting": "02_backend/architecture/paas/_cross_cutting.md",
      "{数据模块A}": "02_backend/architecture/paas/{数据模块A}.md",
      "{数据模块B}": "02_backend/architecture/paas/{数据模块B}.md",
      "{数据模块C}": "02_backend/architecture/paas/{数据模块C}.md",
      "{数据模块D}": "02_backend/architecture/paas/{数据模块D}.md",
      "{数据模块E}": "02_backend/architecture/paas/{数据模块E}.md",
      "{数据模块F}": "02_backend/architecture/paas/{数据模块F}.md",
      "{数据模块G}": "02_backend/architecture/paas/{数据模块G}.md",
      "{数据模块H}": "02_backend/architecture/paas/{数据模块H}.md",
      "{数据模块I}": "02_backend/architecture/paas/{数据模块I}.md",
      "{数据模块J}": "02_backend/architecture/paas/{数据模块J}.md",
      "{数据模块K}": "02_backend/architecture/paas/{数据模块K}.md",
      "{数据模块L}": "02_backend/architecture/paas/{数据模块L}.md",
      "{数据模块M}": "02_backend/architecture/paas/{数据模块M}.md",
      "{模块A}": "02_backend/architecture/paas/{模块A}.md",
      "{模块B}": "02_backend/architecture/paas/{模块B}.md",
      "{模块C}": "02_backend/architecture/paas/{模块C}.md",
      "{模块D}": "02_backend/architecture/paas/{模块D}.md",
      "{模块E}": "02_backend/architecture/paas/{模块E}.md",
      "{模块F}": "02_backend/architecture/paas/{模块F}.md",
      "{模块H}_LogConnector": "02_backend/architecture/paas/{模块H}_LogConnector.md",